question_id,intent,rewritten_intent,snippet,idx,time_batch,cluster,gradual_batch,gradual_new
6429638,How to split a string into integers in Python?,split a string `42 0` by white spaces.,"""""""42 0"""""".split()",1149,20,8,0,0
6504200,How to decode unicode raw literals to readable string?,decode unicode string `s` into a readable unicode literal,s.decode('unicode_escape'),1154,20,8,0,0
6539881,Python: Converting from ISO-8859-1/latin1 to UTF-8,convert string `apple` from iso-8859-1/latin1 to utf-8,apple.decode('iso-8859-1').encode('utf8'),1157,20,8,0,0
6696027,split elements of a list in python,Split each string in list `myList` on the tab character,myList = [i.split('\t')[0] for i in myList],1171,21,8,0,0
6714826,How can I determine the byte length of a utf-8 encoded string in Python?,Determine the byte length of a utf-8 encoded string `s`,return len(s.encode('utf-8')),1173,21,8,0,0
6740865,Convert Unicode to UTF-8 Python,print a unicode string `text`,print(text.encode('windows-1252')),1176,21,8,0,0
6797984,convert string to lowercase,convert string `s` to lowercase,s.lower(),1178,21,8,0,0
6797984,convert string to lowercase,convert utf-8 string `s` to lowercase,s.decode('utf-8').lower(),1179,21,8,0,0
6916542,Writing List of Strings to Excel CSV File in Python,write a list of strings `row` to csv object `csvwriter`,csvwriter.writerow(row),1188,21,8,0,0
7126916,Perform a string operation for every element in a Python list,formate each string cin list `elements` into pattern '%{0}%',elements = ['%{0}%'.format(element) for element in elements],1196,21,8,0,0
7173850,Possible to get user input without inserting a new line?,"get user input using message 'Enter name here: ' and insert it to the first placeholder in string 'Hello, {0}, how do you do?'","print('Hello, {0}, how do you do?'.format(input('Enter name here: ')))",1204,22,8,0,0
7253803,How to get everything after last slash in a URL?,get everything after last slash in a url stored in variable 'url',"url.rsplit('/', 1)[-1]",1208,22,8,0,0
7262828,python : how to convert string literal to raw string literal?,convert a string literal `s` with values `\\` to raw string literal,"s = s.replace('\\', '\\\\')",1210,22,8,0,0
7568627,Using Python String Formatting with Lists,Unpack each value in list `x` to its placeholder '%' in string '%.2f',""""""", """""".join(['%.2f'] * len(x))",1241,23,8,0,0
7856296,Parsing CSV / tab-delimited txt file with Python,parse tab-delimited CSV file 'text.txt' into a list,"lol = list(csv.reader(open('text.txt', 'rb'), delimiter='\t'))",1264,23,8,0,0
7934620,python: dots in the name of variable in a format string,python: dots in the name of variable in a format string,"""""""Name: {0[person.name]}"""""".format({'person.name': 'Joe'})",1268,23,8,0,0
8172861,Python Regex replace,Replace comma with dot in a string `original_string` using regex,"new_string = re.sub('""(\\d+),(\\d+)""', '\\1.\\2', original_string)",1288,24,8,0,0
8199398,Extracting only characters from a string in Python,Extract only characters from a string as a list,"re.split('[^a-zA-Z]*', 'your string')",1296,24,0,0,0
8218032,How to turn a boolean array into index array in numpy,Get all indexes of boolean numpy array where boolean value `mask` is True,numpy.where(mask),1302,24,6,0,0
8247792,Python - How to cut a string in Python?,cut a string by delimiter '&',s.rfind('&'),1306,24,8,0,0
8247792,Python - How to cut a string in Python?,cut a string using delimiter '&',s[:s.rfind('&')],1308,24,8,0,0
8270092,remove all whitespace in a string,remove all whitespaces in a string `sentence`,sentence = ''.join(sentence.split()),1310,24,8,0,0
8270092,remove all whitespace in a string,remove all whitespaces in string `sentence`,"sentence = re.sub('\\s+', '', sentence, flags=re.UNICODE)",1311,24,8,0,0
8270092,remove all whitespace in a string,remove whitespace in string `sentence` from beginning and end,sentence.strip(),1312,24,8,0,0
8270092,remove all whitespace in a string,remove all whitespace in a string `sentence`,"pattern = re.compile('\\s+')
sentence = re.sub(pattern, '', sentence)",1313,24,8,0,0
8270092,remove all whitespace in a string,remove all whitespace in a string `sentence`,"sentence.replace(' ', '')",1314,24,8,0,0
8344905,Pythons fastest way of randomising case of a string,randomly switch letters' cases in string `s`,""""""""""""".join(x.upper() if random.randint(0, 1) else x for x in s)",1321,25,8,0,0
8687018,Python string replace two things at once?,replace each 'a' with 'b' and each 'b' with 'a' in the string 'obama' in a single pass.,"""""""obama"""""".replace('a', '%temp%').replace('b', 'a').replace('%temp%', 'b')",1348,25,8,0,0
8691311,Python: How to write multiple strings in one line?,"write multiple strings `line1`, `line2` and `line3` in one line in a file `target`","target.write('%r\n%r\n%r\n' % (line1, line2, line3))",1351,25,8,0,0
8740353,How to convert a string data to a JSON object in python?,convert a urllib unquoted string `unescaped` to a json data `json_data`,json_data = json.loads(unescaped),1358,26,8,0,0
8751653,How can I convert a binary to a float number,convert a binary '-0b1110' to a float number,"float(int('-0b1110', 0))",1361,26,5,0,0
8898294,Convert UTF-8 with BOM to UTF-8 with no BOM in Python,convert utf-8 with bom string `s` to utf-8 with no bom `u`,u = s.decode('utf-8-sig'),1365,26,8,0,0
8901996,How to print container object with unicode-containing values?,decode utf-8 code `x` into a raw unicode literal,print(str(x).decode('raw_unicode_escape')),1367,26,8,0,0
8905864,URL encoding in python,Replace special characters in utf-8 encoded string `s` using the %xx escape,urllib.parse.quote(s.encode('utf-8')),1369,26,8,0,0
8908287,Base64 encoding in Python 3,encode a string `data to be encoded` to `ascii` encoding,encoded = 'data to be encoded'.encode('ascii'),1370,26,8,0,0
8908287,Base64 encoding in Python 3,encode string 'data to be encoded',encoded = base64.b64encode('data to be encoded'),1371,26,8,0,0
8924173,How do I print bold text in Python?,print bold text 'Hello',print('\x1b[1m' + 'Hello'),1373,26,8,0,0
9079540,"how to get around ""Single '}' encountered in format string"" when using .format and formatting in printing","Escape character '}' in string '{0}:<15}}{1}:<15}}{2}:<8}}' while using function `format` with arguments `('1', '2', '3')`","print('{0}:<15}}{1}:<15}}{2}:<8}}'.format('1', '2', '3'))",1388,26,8,0,0
9206964,How to split string into words that do not contain whitespaces in python?,"split string ""This     is a     string"" into words that does not contain whitespaces","""""""This     is a     string"""""".split()",1392,26,8,0,0
9257094,change a string into uppercase,change string `s` to upper case,s.upper(),1401,27,8,0,0
9339630,Unescaping escaped characters in a string using Python 3.2,encode string `s` to utf-8 code,s.encode('utf8'),1408,27,8,0,0
9470142,Remove string between 2 characters from text string,remove all square brackets from string 'abcd[e]yth[ac]ytwec',"re.sub('\\[.*?\\]', '', 'abcd[e]yth[ac]ytwec')",1415,27,8,0,0
9505526,Split string into strings of repeating elements,split string `s` into strings of repeating elements,"print([a for a, b in re.findall('((\\w)\\2*)', s)])",1418,27,8,0,0
9743134,Python Regex Split Keeps Split Pattern Characters,split a string `Docs/src/Scripts/temp` by `/` keeping `/` in the result,"""""""Docs/src/Scripts/temp"""""".replace('/', '/\x00/').split('\x00')",1442,28,8,0,0
9760588,How do you extract a url from a string using python?,extract a url from a string `myString`,"print(re.findall('(https?://[^\\s]+)', myString))",1448,28,8,0,0
9760588,How do you extract a url from a string using python?,extract a url from a string `myString`,"print(re.search('(?P<url>https?://[^\\s]+)', myString).group('url'))",1449,28,8,0,0
9841303,Removing duplicate characters from a string,"removing duplicate characters from a string variable ""foo""",""""""""""""".join(set(foo))",1452,28,8,0,0
9905471,string to list conversion in python,"split string `s` to list conversion by ','","[x.strip() for x in s.split(',')]",1458,28,8,0,0
9969684,How do I add space between two variables after a print in Python,Print variable `count` and variable `conv` with space string '    ' in between,print(str(count) + '    ' + str(conv)),1462,28,8,0,0
10037742,Replace part of a string in Python?,replace string ' and ' in string `stuff` with character '/',"stuff.replace(' and ', '/')",1464,28,8,0,0
10351772,converting list of string to list of integer,converting list of strings `intstringlist` to list of integer `nums`,nums = [int(x) for x in intstringlist],1481,29,5,0,0
10525301,String encoding and decoding from possibly latin1 and utf8,Normalize string `str` from 'cp1252' code to 'utf-8' code,print(str.encode('cp1252').decode('utf-8').encode('cp1252').decode('utf-8')),1497,29,8,0,0
10562778,Replacing characters in a file,replace character 'a' with character 'e' and character 's' with character '3' in file `contents`,"newcontents = contents.replace('a', 'e').replace('s', '3')",1502,29,8,0,0
10569438,How to print Unicode character in Python?,print unicode characters in a string `\u0420\u043e\u0441\u0441\u0438\u044f`,print('\u0420\u043e\u0441\u0441\u0438\u044f'),1506,29,8,0,0
10697757,Python regular expression split() string,Split a string `s` by space with `4` splits,"s.split(' ', 4)",1520,30,8,0,0
10750802,Disable abbreviation in argparse,disable abbreviation in argparse,parser = argparse.ArgumentParser(allow_abbrev=False),1522,30,8,0,0
10824319,Python: How to convert a string containing hex bytes to a hex string,convert a string `s` containing hex bytes to a hex string,binascii.a2b_hex(s),1525,30,8,0,0
10824319,Python: How to convert a string containing hex bytes to a hex string,Convert a string `s` containing hex bytes to a hex string,s.decode('hex'),1526,30,8,0,0
10974932,python split string based on regular expression,split string `str1` on one or more spaces with a regular expression,"re.split(' +', str1)",1537,30,8,0,0
11009155,how to split a string on the first instance of delimiter in python,"split string ""jvm.args= -Dappdynamics.com=true, -Dsomeotherparam=false,"" on the first occurrence of delimiter '='","""""""jvm.args= -Dappdynamics.com=true, -Dsomeotherparam=false,"""""".split('=', 1)",1541,30,8,0,0
11040626,Pandas DataFrame Add column to index without resetting,add column `d` to index of dataframe `df`,"df.set_index(['d'], append=True)",1542,30,3,0,0
11174790,Convert unicode string to byte string,convert unicode string '\xd0\xbc\xd0\xb0\xd1\x80\xd0\xba\xd0\xb0' to byte string,'\xd0\xbc\xd0\xb0\xd1\x80\xd0\xba\xd0\xb0'.encode('latin-1'),1550,31,8,0,0
11277432,How to remove a key from a python dictionary?,remove a key 'key' from a dictionary `my_dict`,"my_dict.pop('key', None)",1557,31,1,0,0
11331982,How to remove any URL within a string in Python,remove any url within string `text`,"text = re.sub('^https?:\\/\\/.*[\\r\\n]*', '', text, flags=re.MULTILINE)",1562,31,8,0,0
11354544,Read lines containing integers from a file in Python?,strip and split each line `line` on white spaces,line.strip().split(' '),1569,31,8,0,0
11403474,Python Regex - Remove special characters but preserve apostraphes,"remove all non -word, -whitespace, or -apostrophe characters from string `doesn't this mean it -technically- works?`","re.sub(""[^\\w' ]"", '', ""doesn't this mean it -technically- works?"")",1576,31,8,0,0
11755208,How to remove ^M from a text file and replace it with the next line,replace carriage return in string `somestring` with empty string '',"somestring.replace('\\r', '')",1600,32,8,0,0
11833266,How do I read the first line of a string?,read the first line of a string `my_string`,my_string.splitlines()[0],1609,32,8,0,0
11833266,How do I read the first line of a string?,How do I read the first line of a string?,"my_string.split('\n', 1)[0]",1610,32,8,0,0
11921649,What is the most pythonic way to avoid specifying the same value in a string,"Format string `hello {name}, how are you {name}, welcome {name}` to be interspersed by `name` three times, specifying the value as `john` only once","""""""hello {name}, how are you {name}, welcome {name}"""""".format(name='john')",1616,32,8,0,0
12309976,convert list into string with spaces in python,convert a list `my_list` into string with values separated by spaces,""""""" """""".join(my_list)",1636,33,8,0,0
12492137,Python sum of ASCII values of all characters in a string,python sum of ascii values of all characters in a string `string`,"sum(map(ord, string))",1652,33,8,0,0
12527959,Passing the '+' character in a POST request in Python,replace percent-encoded code in request `f` to their single-character equivalent,"f = urllib.request.urlopen(url, urllib.parse.unquote(urllib.parse.urlencode(params)))",1654,33,8,0,0
12666897,Removing an item from list matching a substring - Python,Remove all strings from a list a strings `sents` where the values starts with `@$\t` or `#`,[x for x in sents if not x.startswith('@$\t') and not x.startswith('#')],1663,33,8,0,0
12723751,Replacing instances of a character in a string,Replace `;` with `:` in a string `line`,"line = line.replace(';', ':')",1667,34,8,0,0
12883376,Remove the first word in a Python string?,remove first word in string `s`,"s.split(' ', 1)[1]",1683,34,8,0,0
12985456,Replace all non-alphanumeric characters in a string,Replace all non-alphanumeric characters in a string,"re.sub('[^0-9a-zA-Z]+', '*', 'h^&ell`.,|o w]{+orld')",1688,34,8,0,0
13002848,How do I convert an array to string using the jinja template engine?,Jinja join elements of array `tags` with space string ' ',{{tags | join(' ')}},1690,34,8,0,0
13093727,How to replace unicode characters in string with something else python?,replace unicode character '\u2022' in string 'str' with '*',"str.decode('utf-8').replace('\u2022', '*').encode('utf-8')",1701,34,8,0,0
13128565,String splitting in Python,split string `s` by letter 's',s.split('s'),1703,34,8,0,0
13142347,How to remove leading and trailing zeros in a string? Python,remove leading and trailing zeros in the string 'your_Strip',your_string.strip('0'),1704,34,8,0,0
13209288,Python split string based on regex,Split string `input` at every space followed by an upper-case letter,"re.split('[ ](?=[A-Z])', input)",1712,35,8,0,0
13655392,Python- insert a character into a string,"insert a character ',' into a string in front of '+' character in second part of the string",""""""",+"""""".join(c.rsplit('+', 1))",1767,36,8,0,0
13656519,Python . How to get rid of '\r' in string?,strip a string `line` of all carriage returns and newlines,line.strip(),1768,36,8,0,0
13781828,Replace a string in list of lists,Truncate `\r\n` from each string in a list of string `example`,"example = [x.replace('\r\n', '') for x in example]",1775,36,8,0,0
13793973,Easiest way to remove unicode representations from a string in python 3?,Print string `t` with proper unicode representations,print(t.decode('unicode_escape')),1777,36,8,0,0
13837848,Converting byte string in unicode string,converting byte string `c` in unicode string,c.decode('unicode_escape'),1779,36,8,0,0
13945749,String Formatting in Python 3,format the variables `self.goals` and `self.penalties` using string formatting,"""""""({:d} goals, ${:d})"""""".format(self.goals, self.penalties)",1791,37,8,0,0
13945749,String Formatting in Python 3,"format string ""({0.goals} goals, ${0.penalties})""","""""""({0.goals} goals, ${0.penalties})"""""".format(self)",1792,37,8,0,0
13945749,String Formatting in Python 3,"format string ""({} goals, ${})"" with variables `goals` and `penalties`","""""""({} goals, ${})"""""".format(self.goals, self.penalties)",1793,37,8,0,0
14041791,print variable and a string in python,Print a string `card` with string formatting,print('I have: {0.price}'.format(card)),1798,37,8,0,0
14043934,time offset,substract 1 hour and 10 minutes from current time,"t = datetime.datetime.now()
(t - datetime.timedelta(hours=1, minutes=10))",1803,37,2,0,0
14431731,Replacing the empty strings in a string,insert string `string1` after each character of `string2`,"string2.replace('', string1)[len(string1):-len(string1)]",1832,38,8,0,0
14737222,How to split a word into letters in Python,"Split string `Hello` into a string of letters seperated by `,`",""""""","""""".join('Hello')",1854,38,8,0,0
14750675,Delete letters from string,delete letters from string '12454v',""""""""""""".join(filter(str.isdigit, '12454v'))",1858,38,8,0,0
15012228,Splitting on last delimiter in Python string?,split a string `s` on last delimiter,"s.rsplit(',', 1)",1884,39,8,0,0
15043326,getting string between 2 characters in python,getting the string between 2 '$' characters in '$sin (x)$ is an function of x',"re.findall('\\$(.*?)\\$', '$sin (x)$ is an function of x')",1886,39,8,0,0
15043326,getting string between 2 characters in python,get all characters between two `$` characters in string `string`,"re.findall('\\$([^$]*)\\$', string)",1887,39,8,0,0
15175142,How can I do multiple substitutions using regex in python?,double each character in string `text.read()`,"re.sub('(.)', '\\1\\1', text.read(), 0, re.S)",1899,39,8,0,0
15210485,python regex get first part of an email address,split string `s` by '@' and get the first element,s.split('@')[0],1901,40,8,0,0
15286401,Print multiple arguments in python,print a string using multiple strings `name` and `score`,"print('Total score for %s is %s  ' % (name, score))",1910,40,8,0,0
15390374,Python 3: How do I get a string literal representation of a byte string?,get a utf-8 string literal representation of byte string `x`,"""""""x = {}"""""".format(x.decode('utf8')).encode('utf8')",1918,40,8,0,0
15392730,"In Python, is it possible to escape newline characters when printing a string?",Print new line character as `\n` in a string `foo\nbar`,print('foo\nbar'.encode('string_escape')),1919,40,8,0,0
15740236,Stdout encoding in python,encode unicode string '\xc5\xc4\xd6' to utf-8 code,print('\xc5\xc4\xd6'.encode('UTF8')),1940,41,8,0,0
15851568,how to get the last part of a string before a certain character?,Split a string `x` by last occurrence of character `-`,print(x.rpartition('-')[0]),1947,41,8,0,0
15851568,how to get the last part of a string before a certain character?,get the last part of a string before the character '-',"print(x.rsplit('-', 1)[0])",1948,41,8,0,0
15886340,How to extract all UPPER from a string? Python,remove uppercased characters in string `s`,"re.sub('[^A-Z]', '', s)",1954,41,8,0,0
16050952,How to remove all the punctuation in a string? (Python),"remove the punctuation '!', '.', ':' from a string `asking`","out = ''.join(c for c in asking if c not in ('!', '.', ':'))",1961,41,8,0,0
16159228,Formatting text to be justified in Python 3.3 with .format() method,right align string `mystring` with a width of 7,"""""""{:>7s}"""""".format(mystring)",1972,41,8,0,0
16233593,How to strip comma in Python string,replace comma in string `s` with empty string '',"s = s.replace(',', '')",1978,42,8,0,0
16566069,Url decode UTF-8 in Python,decode a urllib escaped url string `url` with `utf8`,url = urllib.parse.unquote(url).decode('utf8'),1993,42,8,0,0
16566069,Url decode UTF-8 in Python,decode url `url` with utf8 and print it,print(urllib.parse.unquote(url).decode('utf8')),1994,42,8,0,0
16866261,Detecting non-ascii characters in unicode string,"Strip all non-ASCII characters from a unicode string, `\xa3\u20ac\xa3\u20ac`","print(set(re.sub('[\x00-\x7f]', '', '\xa3\u20ac\xa3\u20ac')))",2008,42,8,0,0
16866261,Detecting non-ascii characters in unicode string,Get all non-ascii characters in a unicode string `\xa3100 is worth more than \u20ac100`,"print(re.sub('[\x00-\x7f]', '', '\xa3100 is worth more than \u20ac100'))",2009,42,8,0,0
17027690,How to skip the extra newline while printing lines read from a file?,skip the newline while printing `line`,print(line.rstrip('\n')),2017,43,8,0,0
17038426,splitting a string based on tab in the file,split a string `yas` based on tab '\t',"re.split('\\t+', yas.rstrip('\t'))",2018,43,8,0,0
17193850,How to get column by number in Pandas?,get all the values in column `b` from pandas data frame `df`,df['b'],2044,43,3,0,0
17731822,Elegant way to convert list to hex string,Convert list of booleans `walls` into a hex string,"hex(int(''.join([str(int(b)) for b in walls]), 2))",2078,44,8,0,0
17895835,format strings and named arguments in Python,"replace placeholders in string '{1} {ham} {0} {foo} {1}' with arguments `(10, 20, foo='bar', ham='spam')`","""""""{1} {ham} {0} {foo} {1}"""""".format(10, 20, foo='bar', ham='spam')",2091,44,8,0,0
18272066,Easy way to convert a unicode list to a list containing python strings?,Encode each value to 'UTF8' in the list `EmployeeList`,[x.encode('UTF8') for x in EmployeeList],2118,45,8,0,0
18319101,What's the best way to generate random strings of a specific length in Python?,generate random upper-case ascii string of 12 characters length,print(''.join(choice(ascii_uppercase) for i in range(12))),2121,45,8,0,0
18391059,python - How to format variable number of arguments into a string?,how to format a list of arguments `my_args` into a string,"'Hello %s' % ', '.join(my_args)",2126,45,8,0,0
18454570,How can i subtract two strings in python?,"remove substring 'bag,' from a string 'lamp, bag, mirror'","print('lamp, bag, mirror'.replace('bag,', ''))",2131,45,8,0,0
18504967,pandas dataframe create new columns and fill with calculated values from same df,create new column `A_perc` in dataframe `df` with row values equal to the value in column `A` divided by the value in column `sum`,df['A_perc'] = df['A'] / df['sum'],2137,46,3,0,0
18551752,Python - split sentence after words but with maximum of n characters in result,split string `text` into chunks of 16 characters each,"re.findall('.{,16}\\b', text)",2142,46,8,0,0
18609153,Format() in Python Regex,"format parameters 'b' and 'a' into plcaeholders in string ""{0}\\w{{2}}b{1}\\w{{2}}quarter""","""""""{0}\\w{{2}}b{1}\\w{{2}}quarter"""""".format('b', 'a')",2144,46,8,0,0
18649884,Python list comprehension for loops,Get a list from two strings `12345` and `ab` with values as each character concatenated,[(x + y) for x in '12345' for y in 'ab'],2148,46,8,0,0
18711384,how to split a unicode string into list,split a `utf-8` encoded string `stru` into a list of characters,list(stru.decode('utf-8')),2156,46,8,0,0
18723580,"python: rstrip one exact string, respecting order",strip the string `.txt` from anywhere in the string `Boat.txt.txt`,"""""""Boat.txt.txt"""""".replace('.txt', '')",2158,46,8,0,0
18785032,Replace a substring when it is a separate word,Replace a separate word 'H3' by 'H1' in a string 'text',"re.sub('\\bH3\\b', 'H1', text)",2162,46,8,0,0
18886596,Replace all quotes in a string with escaped quotes?,double backslash escape all double quotes in string `s`,"print(s.encode('unicode-escape').replace('""', '\\""'))",2168,46,8,0,0
19095796,How to print backslash with Python?,print backslash,print('\\'),2179,47,8,0,0
19527279,Python - Unicode to ASCII conversion,convert unicode string `s` to ascii,s.encode('iso-8859-15'),2201,47,8,0,0
19641579,Python convert tuple to string,"concatenate strings in tuple `('a', 'b', 'c', 'd', 'g', 'x', 'r', 'e')` into a single string",""""""""""""".join(('a', 'b', 'c', 'd', 'g', 'x', 'r', 'e'))",2214,48,8,0,0
19794051,Regex for removing data in parenthesis,Remove all data inside parenthesis in string `item`,"item = re.sub(' \\(\\w+\\)', '', item)",2224,48,8,0,0
19794051,Regex for removing data in parenthesis,Remove anything in parenthesis from string `item` with a regex,"item = re.sub(' ?\\([^)]+\\)', '', item)",2226,48,0,0,0
19894478,Regex punctuation split [Python],"split string 'Words, words, words.' on punctuation","re.split('\\W+', 'Words, words, words.')",2231,48,8,0,0
20078816,Replace non-ASCII characters with a single space,Replace non-ASCII characters in string `text` with a single space,"re.sub('[^\\x00-\\x7F]+', ' ', text)",2243,48,8,0,0
20735384,Regex Python adding characters after a certain word,add character '@' after word 'get' in string `text`,"text = re.sub('(\\bget\\b)', '\\1@', text)",2278,49,8,0,0
20774910,How can I convert a unicode string into string literals in Python 2.7?,convert unicode string `s` into string literals,print(s.encode('unicode_escape')),2279,49,8,0,0
20876077,Python: unescape special characters without splitting data,"unescape special characters without splitting data in array of strings `['I ', u'<', '3s U ', u'&', ' you luvz me']`",""""""""""""".join(['I ', '<', '3s U ', '&', ' you luvz me'])",2286,49,8,0,0
21129020,"How to fix: ""UnicodeDecodeError: 'ascii' codec can't decode byte""",set the default encoding to 'utf-8',sys.setdefaultencoding('utf8'),2296,50,8,0,0
21205074,How to split a string at line breaks in python?,split a string `s` at line breaks `\r\n`,"[map(int, x.split('\t')) for x in s.rstrip().split('\r\n')]",2299,50,8,0,0
21261330,Splitting string and removing whitespace Python,"Split string with comma (,) and remove whitespace from a string 'my_string'","[item.strip() for item in my_string.split(',')]",2302,50,8,0,0
21669374,convert string to hex in python,convert string 'a' to hex,hex(ord('a')),2313,50,8,0,0
21887754,numpy concatenate two arrays vertically,numpy concatenate two arrays `a` and `b` along the first axis,"print(concatenate((a, b), axis=0))",2332,51,6,0,0
21947035,Print string as hex literal python,"print string ""ABC"" as hex literal","""""""ABC"""""".encode('hex')",2335,51,8,0,0
22187233,How to delete all instances of a character in a string in python?,How to delete all instances of a character in a string in python?,""""""""""""".join([char for char in 'it is icy' if char != 'i'])",2341,51,8,0,0
22187233,How to delete all instances of a character in a string in python?,"delete all characters ""i"" in string ""it is icy""","""""""it is icy"""""".replace('i', '')",2342,51,8,0,0
