question_id,intent,rewritten_intent,snippet,idx,time_batch,cluster,gradual_batch,gradual_new
42950,Get Last Day of the Month,Get Last Day of the first month in 2002,"calendar.monthrange(2002, 1)",30,0,2,0,0
113534,Is there a function in Python to split a string without ignoring the spaces?,split a string `mystring` considering the spaces ' ',"mystring.replace(' ', '! !').split('!')",67,0,8,0,0
113655,Is there a function in python to split a word into a list?,split string `Word to Split` into a list of characters,list('Word to Split'),68,0,8,0,0
172439,How do I split a multi-line string into multiple lines?,split a multi-line string `inputString` into separate strings,inputString.split('\n'),77,0,8,0,0
172439,How do I split a multi-line string into multiple lines?,Split a multi-line string ` a \n b \r\n c ` by new line character `\n`,' a \n b \r\n c '.split('\n'),78,0,8,0,0
186857,"Splitting a semicolon-separated string to a dictionary, in Python",split a string `s` by ';' and convert to a dictionary,dict(item.split('=') for item in s.split(';')),84,0,8,0,0
199059,I'm looking for a pythonic way to insert a space before capital letters,insert spaces before capital letters in string `text`,"re.sub('([a-z](?=[A-Z])|[A-Z](?=[A-Z][a-z]))', '\\1 ', text)",86,0,8,0,0
200738,How can I unpack binary hex formatted data in Python?,encode string `data` as `hex`,data.encode('hex'),87,0,8,0,0
227459,"get the <a href=""http://en.wikipedia.org/wiki/ASCII"" rel=""nofollow noreferrer"">ASCII</a> value of a character as an int",get the ASCII value of a character u'あ' as an int,ord('\u3042'),99,0,8,0,0
234512,Splitting strings in python,split a string 's' by space while ignoring spaces within square braces and quotes.,"re.findall('\\[[^\\]]*\\]|""[^""]*""|\\S+', s)",100,0,8,0,0
258746,Slicing URL with Python,"Slice `url` with '&' as delimiter  to get  ""http://www.domainname.com/page?CONTENT_ITEM_ID=1234"" from url ""http://www.domainname.com/page?CONTENT_ITEM_ID=1234&param2&param3
""",url.split('&'),114,0,8,0,0
265960,Best way to strip punctuation from a string in Python,Strip punctuation from string `s`,"s.translate(None, string.punctuation)",115,0,8,0,0
275018,remove (chomp) a newline,remove newline in string 'Mac EOL\r','Mac EOL\r'.rstrip('\r\n'),120,0,8,0,0
275018,remove (chomp) a newline,remove newline in string 'Windows EOL\r\n' on the right side,'Windows EOL\r\n'.rstrip('\r\n'),121,0,8,0,0
275018,remove (chomp) a newline,remove newline in string 'Unix EOL\n' on the right side,'Unix EOL\n'.rstrip('\r\n'),122,0,8,0,0
275018,remove (chomp) a newline,remove newline in string `s` on the right side,s.rstrip(),123,0,8,0,0
275018,remove (chomp) a newline,remove newline in string `s`,s.strip(),124,0,8,0,0
275018,remove (chomp) a newline,remove trailing newline in string 'test string \n\n','test string \n\n'.rstrip('\n'),125,0,8,0,0
275018,remove (chomp) a newline,"remove newline in string ""Hello\n\n\n"" on the right side",'Hello\n\n\n'.rstrip('\n'),126,0,8,0,0
275018,remove (chomp) a newline,"remove trailing newline in string ""test string\n""",'test string\n'.rstrip(),127,0,8,0,0
275018,remove (chomp) a newline,remove newline in string `s` on the left side,s.lstrip(),128,0,8,0,0
364519,iterate over a dictionary in sorted order,iterate over a dictionary `foo` sorted by the key,"for k in sorted(foo.keys()):
    pass",156,0,1,0,0
367155,Splitting a string into words and punctuation,split a unicode string `text` into a list of words and punctuation characters with a regex,"re.findall('\\w+|[^\\w\\s]', text, re.UNICODE)",168,0,8,0,0
373459,split string on a number of different characters,"split string 'a b.c' on space "" "" and dot character "".""","re.split('[ .]', 'a b.c')",171,0,8,0,0
415511,get current time,get current time,datetime.datetime.now().time(),186,0,2,0,0
432842,get the logical xor of two variables,get logical xor of `a` and `b`,(bool(a) != bool(b)),193,0,0,0,0
436599,Python Split String,truncate string `s` up to character ':',"s.split(':', 1)[1]",194,0,8,0,0
464736,Python regular expressions - how to capture multiple groups from a wildcard expression?,split string 'abcdefg' into a list of characters,"re.findall('\\w', 'abcdefg')",207,0,8,0,0
493386,print in Python without newline or space,"print ""."" without newline",sys.stdout.write('.'),210,0,8,0,0
510357,read a single character from the user,read a single character from stdin,sys.stdin.read(1),219,0,8,0,0
518021,Getting the length of an array,Getting the length of `my_string`,len(my_string),226,0,8,0,0
640001,How can I remove text within parentheses with a regex?,remove parentheses and text within it in string `filename`,"re.sub('\\([^)]*\\)', '', filename)",257,0,8,0,0
663171,substring a string,get a new string including the first two characters of string `x`,x[:2],263,0,8,0,0
663171,substring a string,get a new string including all but the last character of string `x`,x[:(-2)],264,0,8,0,0
663171,substring a string,get a new string with the 3rd to the second-to-last characters of string `x`,x[2:(-2)],265,0,8,0,0
663171,get a new string from the 3rd character to the end of the string,get a new string from the 3rd character to the end of the string `x`,x[2:],266,0,8,0,0
663171,reversing a string,reverse a string `some_string`,some_string[::(-1)],267,0,8,0,0
663171,selecting alternate characters,"select alternate characters of ""H-e-l-l-o- -W-o-r-l-d""",'H-e-l-l-o- -W-o-r-l-d'[::2],269,0,8,0,0
663171,substring a string,get a new string including the last two characters of string `x`,x[(-2):],270,0,8,0,0
674509,"How do I iterate over a Python dictionary, ordered by values?",Iterate over dictionary `d` in ascending order of values,"sorted(iter(d.items()), key=lambda x: x[1])",273,0,1,0,0
727507,How can I convert Unicode to uppercase to print it?,print unicode string `ex\xe1mple` in uppercase,print('ex\xe1mple'.upper()),297,0,8,0,0
743806,Split string into a list,Split string `line` into a list by whitespace,line.split(),303,0,8,0,0
743806,Split string into a list,"split string `text` by "",""","text.split(',')",304,0,8,0,0
743806,Split string into a list,split string `text` by space,text.split(),305,0,8,0,0
753052,Strip HTML from strings in Python,strip html from strings,"re.sub('<[^<]+?>', '', text)",309,0,8,0,0
761804,Trimming a string,"Trimming a string ""Bob has a cat""",'Bob has a cat'.strip(),311,0,8,0,0
761804,Trimming a string,"left trimming ""\n\r"" from string `myString`",myString.lstrip('\n\r'),312,0,8,0,0
761804,Trimming a string,"right trimming ""\n\t"" from string `myString`",myString.rstrip('\n\t'),313,0,8,0,0
761804,Trimming a string,"Trimming a string ""  Hello\n"" by space",'  Hello\n'.strip(' '),314,0,8,0,0
761804,Trimming a string,"Trimming ""\n"" from string `myString`",myString.strip('\n'),315,0,8,0,0
761804,Trimming a string,Trimming a string `str`,str.strip(),316,0,8,0,0
761804,Trimming a string,"Trimming a string "" Hello """,' Hello '.strip(),318,0,8,0,0
761804,Trimming a string,trim string `myString `,myString.strip(),319,0,8,0,0
761804,Trimming a string,"trim string "" Hello """,' Hello '.strip(),320,0,8,0,0
761804,Trimming a string,"Trimming a string ""          Hello        """,'          Hello        '.strip(),321,0,8,0,0
817122,Delete digits in Python (Regex),delete all digits in string `s` that are not directly attached to a word character,"re.sub('$\\d+\\W+|\\b\\d+\\b|\\W+\\d+$', '', s)",332,0,8,0,0
817122,Delete digits in Python (Regex),delete digits at the end of string `s`,"re.sub('\\b\\d+\\b', '', s)",333,0,8,0,0
817122,Delete digits in Python (Regex),Delete self-contained digits from string `s`,"s = re.sub('^\\d+\\s|\\s\\d+\\s|\\s\\d+$', ' ', s)",334,0,8,0,0
867866,Convert unicode codepoint to UTF8 hex in python,convert Unicode codepoint to utf8 hex,"chr(int('fd9b', 16)).encode('utf-8')",349,0,8,0,0
875968,How to remove symbols from a string with Python?,remove symbols from a string `s`,"re.sub('[^\\w]', ' ', s)",350,0,8,0,0
931092,Reverse a string,Reverse a string `s`,''.join(reversed(s)),367,0,8,0,0
931092,Reverse a string,Reverse a string `a_string`,"def reversed_string(a_string):
    return a_string[::(-1)]",368,0,8,0,0
931092,Reverse a string,Reverse a string `a_string`,a_string[::(-1)],369,0,8,0,0
931092,Reverse a string,"Reverse a string ""foo""",'foo'[::(-1)],370,0,8,0,0
931092,Reverse a string,Reverse a string 'hello world','hello world'[::(-1)],371,0,8,0,0
931092,Reverse a string,Reverse a string `string`,''.join(reversed(string)),372,0,8,0,0
931092,Reverse a string,Reverse string 'foo',''.join(reversed('foo')),374,0,8,0,0
943809,String manipulation in Cython,replace occurrences of two whitespaces or more with one whitespace ' ' in string `s`,"re.sub(' +', ' ', s)",378,0,8,0,0
961263,Two values from one input in python?,"assign values to two variables, `var1` and `var2` from user input response to `'Enter two numbers here: ` split on whitespace","var1, var2 = input('Enter two numbers here: ').split()",382,1,8,0,0
961632,Converting integer to string,convert `a` to string,str(a),383,1,8,0,0
961632,Converting integer to string,convert `a` to string,a.__str__(),384,1,8,0,0
961632,Converting integer to string,convert `i` to string,str(i),385,1,8,0,0
1010961,String Slicing Python,"remove last comma character ',' in string `s`",""""""""""""".join(s.rsplit(',', 1))",396,1,8,0,0
1015142,Running Python code contained in a string,"run the code contained in string ""print('Hello')""","eval(""print('Hello')"")",398,1,8,0,0
1038824,remove a substring from the end of a string,remove a substring `suffix` from the end of string `text`,"if (not text.endswith(suffix)):
    return text
return text[:(len(text) - len(suffix))]",405,1,8,0,0
1038824,remove a substring from the end of a string,"remove a substring "".com"" from the end of string `url`","print(url.replace('.com', ''))",406,1,8,0,0
1038824,remove a substring from the end of a string,"remove a substring "".com"" from the end of string `url`","if url.endswith('.com'):
    url = url[:(-4)]",407,1,8,0,0
1038824,remove a substring from the end of a string,"remove a substring "".com"" from the end of string `url`","url = re.sub('\\.com$', '', url)",408,1,8,0,0
1059559,Split Strings with Multiple Delimiters?,"split string ""a;bcd,ef g"" on delimiters ';' and ','","""""""a;bcd,ef g"""""".replace(';', ' ').replace(',', ' ').split()",410,1,8,0,0
1185524,trim whitespace,trim whitespace in string `s`,s.strip(),421,2,8,0,0
1185524,trim whitespace (including tabs),trim whitespace (including tabs) in `s` on the left side,s = s.lstrip(),422,2,8,0,0
1185524,trim whitespace (including tabs),trim whitespace (including tabs) in `s` on the right side,s = s.rstrip(),423,2,8,0,0
1185524,trim whitespace (including tabs),trim characters ' \t\n\r' in `s`,s = s.strip(' \t\n\r'),424,2,8,0,0
1185524,trim whitespace (including tabs),trim whitespaces (including tabs) in string `s`,"print(re.sub('[\\s+]', '', s))",425,2,8,0,0
1207457,Convert a Unicode string to a string,Convert a Unicode string `title` to a 'ascii' string,"unicodedata.normalize('NFKD', title).encode('ascii', 'ignore')",430,2,8,0,0
1207457,Convert a Unicode string to a string,Convert a Unicode string `a` to a 'ascii' string,"a.encode('ascii', 'ignore')",431,2,8,0,0
1249388,Removing all non-numeric characters from string in Python,remove all non-numeric characters from string `sdkjh987978asd098as0980a98sd `,"re.sub('[^0-9]', '', 'sdkjh987978asd098as0980a98sd')",435,2,8,0,0
1397827,How to read formatted input in python?,get a list of of elements resulting from splitting user input by commas and stripping white space from each resulting string `s`,"[s.strip() for s in input().split(',')]",451,2,8,0,0
1450897,Python: removing characters except digits from string,substitute ASCII letters in string 'aas30dsa20' with empty string '',"re.sub('\\D', '', 'aas30dsa20')",461,3,8,0,0
1546226,A simple way to remove multiple spaces in a string in Python,remove multiple spaces in a string `foo`,""""""" """""".join(foo.split())",470,3,8,0,0
1749466,What's the most pythonic way of normalizing lineends in a string?,Normalize line ends in a string 'mixed',"mixed.replace('\r\n', '\n').replace('\r', '\n')",499,4,8,0,0
1780174,Split dictionary of lists into list of dictionaries,create a list where each element is a dictionary with keys 'key1' and 'key2' and values corresponding to each value in the lists referenced by keys 'key1' and 'key2' in dictionary `d`,"[{'key1': a, 'key2': b} for a, b in zip(d['key1'], d['key2'])]",503,4,1,0,0
1885181,How do I un-escape a backslash-escaped string in python?,"un-escape a backslash-escaped string in `Hello,\\nworld!`","print('""Hello,\\nworld!""'.decode('string_escape'))",519,4,8,0,0
1957273,"How do I generate a random string (of length X, a-z only) in Python?",generate a random string of length `x`  containing lower cased ASCII letters,""""""""""""".join(random.choice(string.lowercase) for x in range(X))",529,4,8,0,0
2030053,Random strings in Python,Get a random string of length `length`,return ''.join(random.choice(string.lowercase) for i in range(length)),534,4,8,0,0
2077897,Substitute multiple whitespace with single whitespace in Python,substitute multiple whitespace with single whitespace in string `mystring`,""""""" """""".join(mystring.split())",549,5,8,0,0
2094176,split a string in python,split a string `a` with new line character,a.split('\n')[:-1],550,5,8,0,0
2094176,split a string in python,split string `a` using new-line character '\n' as separator,a.rstrip().split('\n'),551,5,8,0,0
2168123,Converting a String to List in Python,"split string ""0,1,2"" based on delimiter ','","""""""0,1,2"""""".split(',')",564,5,8,0,0
2212433,Counting the Number of keywords in a dictionary in python,get number of keys in dictionary `yourdict`,len(list(yourdict.keys())),572,5,1,0,0
2430539,How do I get all the keys that are stored in the Cassandra column family with pycassa?,get a list of all keys in Cassandra database `cf` with pycassa,list(cf.get_range().get_keys()),606,6,1,0,0
2556108,rreplace - How to replace the last occurence of an expression in a string?,replace the last occurence of an expression '</div>' with '</bad>' in a string `s`,"re.sub('(.*)</div>', '\\1</bad>', s)",616,7,8,0,0
2606976,How to replace empty string with zero in comma-separated string?,"get list of string elements in string `data` delimited by commas, putting `0` in place of empty strings","[(int(x) if x else 0) for x in data.split(',')]",631,7,8,0,0
2636755,How to convert hex string to integer in Python?,convert a hex string `x` to string,"y = str(int(x, 16))",640,7,8,0,0
2783079,How do I convert a unicode to a string at the Python level?,Format a string `u'Andr\xc3\xa9'` that has unicode characters,""""""""""""".join(chr(ord(c)) for c in 'Andr\xc3\xa9')",658,8,8,0,0
2783079,How do I convert a unicode to a string at the Python level?,convert a unicode 'Andr\xc3\xa9' to a string,""""""""""""".join(chr(ord(c)) for c in 'Andr\xc3\xa9').decode('utf8')",659,8,8,0,0
2847272,"Python string formatting when string contains ""%s"" without escaping","replace fields delimited by braces {} in string ""Day old bread, 50% sale {0}"" with string 'today'","""""""Day old bread, 50% sale {0}"""""".format('today')",673,8,8,0,0
3008992,case sensitive string replacement in Python,replace a string `Abc` in case sensitive way using maketrans,"""""""Abc"""""".translate(maketrans('abcABC', 'defDEF'))",693,9,8,0,0
3059301,Manipulating binary data in Python,encode string `data` using hex 'hex' encoding,print(data.encode('hex')),697,9,8,0,0
3151146,Replace the single quote (') character from a string,"replace single quote character in string ""didn't"" with empty string ''","""""""didn't"""""".replace(""'"", '')",707,9,8,0,0
3160752,Removing backslashes from a string in Python,remove backslashes from string `result`,"result.replace('\\', '')",709,9,8,0,0
3160752,Removing backslashes from a string in Python,replace backslashes in string `result` with empty string '',"result = result.replace('\\', '')",710,9,8,0,0
3182716,Python unicode string with UTF-8?,Encode a latin character in string `Sopet\xc3\xb3n` properly,'Sopet\xc3\xb3n'.encode('latin-1').decode('utf-8'),712,9,8,0,0
3182716,Python unicode string with UTF-8?,print unicode string '\xd0\xbf\xd1\x80\xd0\xb8' with utf-8,print('\xd0\xbf\xd1\x80\xd0\xb8'.encode('raw_unicode_escape')),713,9,8,0,0
3258573,Pythonic way to insert every 2 elements in a string,Insert a character `-` after every two elements in a string `s`,"""""""-"""""".join(a + b for a, b in zip(s[::2], s[1::2]))",723,9,8,0,0
3283984,Decode Hex String in Python 3,decode a hex string '4a4b4c' to UTF-8.,bytes.fromhex('4a4b4c').decode('utf-8'),734,10,8,0,0
3367288,insert variable values into a string in python,use `%s` operator to print variable values `str1` inside a string,"'first string is: %s, second one is: %s' % (str1, 'geo.tif')",752,10,8,0,0
3475251,Split a string by a delimiter in python,Split a string by a delimiter in python,[x.strip() for x in '2.MATCHES $$TEXT$$ STRING'.split('$$TEXT$$')],772,11,8,0,0
3486384,Output first 100 characters in a string,output first 100 characters in a string `my_string`,print(my_string[0:100]),774,11,8,0,0
3494906,How do I merge a list of dicts into a single dict?,merge a list of dictionaries in list `L` into a single dict,"{k: v for d in L for k, v in list(d.items())}",777,11,1,0,0
3559559,How to delete a character from a string using python?,"Delete character ""M"" from a string `s` using python","s = s.replace('M', '')",790,11,8,0,0
3662142,How to remove tags from a string in python using regular expressions? (NOT in HTML),remove tags from a string `mystring`,"re.sub('<[^>]*>', '', mystring)",796,11,8,0,0
3704731,Replace non-ascii chars from a unicode string in Python,replace non-ascii chars from a unicode string u'm\xfasica',"unicodedata.normalize('NFKD', 'm\xfasica').encode('ascii', 'ignore')",800,11,8,0,0
3845423,Remove empty strings from a list of strings,remove empty strings from list `str_list`,str_list = list([_f for _f in str_list if _f]),823,12,8,0,0
3855093,"How to make a Python string out of non-ascii ""bytes""",convert list `myintegers` into a unicode string,""""""""""""".join(chr(i) for i in myintegers)",825,12,5,0,0
3862010,Is there a generator version of `string.split()` in Python?,split string `string` on whitespaces using a generator,"return (x.group(0) for x in re.finditer(""[A-Za-z']+"", string))",826,12,8,0,0
3878555,How to replace repeated instances of a character with a single instance of that character in python,Replace repeated instances of a character '*' with a single instance in a string 'text',"re.sub('\\*\\*+', '*', text)",830,12,8,0,0
3886669,Tuple to string,convert tuple `tst` to string `tst2`,tst2 = str(tst),832,12,8,0,0
3939361,Remove specific characters from a string,Remove character `char` from a string `a`,"a = a.replace(char, '')",844,12,8,0,0
3939361,Remove specific characters from a string,Remove characters in `b` from a string `a`,"a = a.replace(char, '')",845,12,8,0,0
3939361,Remove specific characters from a string,"Remove characters ""!@#$"" from a string `line`","line = re.sub('[!@#$]', '', line)",847,13,8,0,0
3939361,Remove specific characters from a string,"Remove characters ""!@#$"" from a string `line`","line.translate(None, '!@#$')",848,13,8,0,0
3939361,Remove specific characters from a string,"Remove string ""1"" from string `string`","string.replace('1', '')",849,13,8,0,0
3944876,Casting an int to a string in Python,cast an int `i` to a string and concat to string 'ME','ME' + str(i),854,13,8,0,0
3984539,Python: use regular expression to remove the white space from all lines,replace white spaces in string '  a\n b\n c\nd  e' with empty string '',"re.sub('(?m)^[^\\S\\n]+', '', '  a\n b\n c\nd  e')",861,13,8,0,0
3984539,Python: use regular expression to remove the white space from all lines,remove white spaces from all the lines using a regular expression in string 'a\n b\n c',"re.sub('(?m)^\\s+', '', 'a\n b\n c')",862,13,8,0,0
4008546,How to pad with n characters in Python,pad 'dog' up to a length of 5 characters with 'x',"""""""{s:{c}^{n}}"""""".format(s='dog', n=5, c='x')",869,13,8,0,0
4020539,Process escape sequences in a string,decode escape sequences in string `myString`,myString.decode('string_escape'),870,13,8,0,0
4127344,Transforming the string representation of a dictionary into a real dictionary,transforming the string `s` into dictionary,"dict(map(int, x.split(':')) for x in s.split(','))",882,13,8,0,0
4182603,python: how to convert a string to utf-8,decode the string 'stringnamehere'  to UTF-8,"stringnamehere.decode('utf-8', 'ignore')",896,14,8,0,0
4223923,how to change the case of first letter of a string?,change the case of the first letter in string `s`,return s[0].upper() + s[1:],897,14,8,0,0
4241757,Python/Django: How to remove extra white spaces & tabs from a string?,remove extra white spaces & tabs from a string `s`,""""""" """""".join(s.split())",902,14,8,0,0
4267019,Double-decoding unicode in python,encode `u'X\xc3\xbcY\xc3\x9f'` as unicode and decode with utf-8,'X\xc3\xbcY\xc3\x9f'.encode('raw_unicode_escape').decode('utf-8'),904,14,8,0,0
4270742,How to remove whitespace in BeautifulSoup,remove newlines and whitespace from string `yourstring`,"re.sub('[\\ \\n]{2,}', '', yourstring)",905,14,8,0,0
4302166,Format string dynamically,"format number of spaces between strings `Python`, `:` and `Very Good` to be `20`","print('%*s : %*s' % (20, 'Python', 20, 'Very Good'))",917,14,8,0,0
4324790,Removing control characters from a string in python,removing control characters from a string `s`,return ''.join(ch for ch in s if unicodedata.category(ch)[0] != 'C'),919,14,8,0,0
4357787,python reverse tokens in a string,"Reverse the order of words, delimited by `.`, in string `s`","""""""."""""".join(s.split('.')[::-1])",922,14,8,0,0
4358701,Renaming multiple files in python,remove 20 symbols in front of '.' in string 'unique12345678901234567890.mkv',"re.sub('.{20}(.mkv)', '\\1', 'unique12345678901234567890.mkv')",923,14,8,0,0
4481724,Convert a list of characters into a string,"convert a list of characters `['a', 'b', 'c', 'd']` into a string",""""""""""""".join(['a', 'b', 'c', 'd'])",937,15,8,0,0
4605439,What is the simplest way to swap char in a string with Python?,swap each pair of characters in string `s`,""""""""""""".join([s[x:x + 2][::-1] for x in range(0, len(s), 2)])",953,15,8,0,0
4697006,Python: Split string by list of separators,"split a string `a , b; cdf`  using both commas and semicolons as delimeters","re.split('\\s*,\\s*|\\s*;\\s*', 'a , b; cdf')",974,16,8,0,0
4697006,Python: Split string by list of separators,"Split a string `string` by multiple separators `,` and `;`","[t.strip() for s in string.split(',') for t in s.split(';')]",975,16,8,0,0
4877844,How would I check a string for a certain letter in Python?,"check if string 'x' is  in list `['x', 'd', 'a', 's', 'd', 's']`","'x' in ['x', 'd', 'a', 's', 'd', 's']",1002,16,0,0,0
4928526,"python, format string","python, format string ""{} %s {}"" to have 'foo' and 'bar' in the first and second positions","""""""{} %s {}"""""".format('foo', 'bar')",1019,17,8,0,0
4998629,Python: Split string with multiple delimiters,"split string `str` with delimiter '; ' or delimiter ', '","re.split('; |, ', str)",1026,17,8,0,0
5254445,Add string in a certain position in Python,add string `-` in `4th` position of a string `s`,s[:4] + '-' + s[4:],1051,18,8,0,0
5399112,How do I url encode in Python?,replace special characters in url 'http://spam.com/go/' using the '%xx' escape,urllib.parse.quote('http://spam.com/go/'),1065,18,8,0,0
5453026,String to list in Python,split string 'QH QD JC KD JS' into a list on white spaces,"""""""QH QD JC KD JS"""""".split()",1069,18,8,0,0
5607551,How to urlencode a querystring in Python?,urlencode a querystring 'string_of_characters_like_these:$#@=?%^Q^$' in python 2,urllib.parse.quote_plus('string_of_characters_like_these:$#@=?%^Q^$'),1080,18,8,0,0
5749195,How can I split and parse a string in Python?,How can I split and parse a string in Python?,"""""""2.7.0_bf4fda703454"""""".split('_')",1087,19,8,0,0
5843518,"Remove all special characters, punctuation and spaces from string","remove all special characters, punctuation and spaces from a string `mystring` using regex","re.sub('[^A-Za-z0-9]+', '', mystring)",1095,19,8,0,0
5864271,Reverse a string in Python two characters at a time (Network byte order),reverse a string `a` by 2 characters at a time,""""""""""""".join(reversed([a[i:i + 2] for i in range(0, len(a), 2)]))",1101,19,8,0,0
5864485,How can I split this comma-delimited string in Python?,"print a string `s` by splitting with comma `,`","print(s.split(','))",1102,19,8,0,0
5864485,How can I split this comma-delimited string in Python?,"Create list  by splitting string `mystring` using "","" as delimiter","mystring.split(',')",1103,19,8,0,0
5891453,Is there a Python Library that contains a list of all the ascii characters?,Create a list containing all ascii characters as its elements,[chr(i) for i in range(127)],1107,19,8,0,0
5917537,"In Python, why won't something print without a newline?",immediately see output of print statement that doesn't end in a newline,sys.stdout.flush(),1109,19,8,0,0
6266727,Python: Cut off the last word of a sentence?,cut off the last word of a sentence `content`,""""""" """""".join(content.split(' ')[:-1])",1130,20,8,0,0
6275762,Escaping quotes in string,escaping quotes in string,"replace('""', '\\""')",1131,20,8,0,0
6323296,Python remove anything that is not a letter or number,replace everything that is not an alphabet or a digit with '' in 's'.,"re.sub('[\\W_]+', '', s)",1136,20,8,0,0
6372228,how to parse a list or string into chunks of fixed length,Get a list of strings `split_text` with fixed chunk size `n` from a string `the_list`,"split_list = [the_list[i:i + n] for i in range(0, len(the_list), n)]",1137,20,8,0,0
