question_id,intent,rewritten_intent,snippet,idx,time_batch,cluster,gradual_batch,gradual_new
22187233,How to delete all instances of a character in a string in python?,delete all instances of a character 'i' in a string 'it is icy',"re.sub('i', '', 'it is icy')",2343,51,8,0,0
22187233,How to delete all instances of a character in a string in python?,delete all occurrences of character 'i' in string 'it is icy',""""""""""""".join([char for char in 'it is icy' if char != 'i'])",2344,51,8,0,0
22229255,Confusing with the usage of regex in Python,match zero-or-more instances of lower case alphabet characters in a string `f233op `,"re.findall('([a-z]*)', 'f233op')",2346,51,0,0,0
22520932,"Python, remove all non-alphabet chars from string",remove all non-alphabet chars from string `s`,""""""""""""".join([i for i in s if i.isalpha()])",2355,51,8,0,0
22882922,Splitting a string with repeated characters into a list using regex,split a string `s` with into all strings of repeated characters,"[m.group(0) for m in re.finditer('(\\d)\\1*', s)]",2366,51,8,0,0
23164058,How to encode text to base64 in python,encode binary string 'your string' to base64 code,"base64.b64encode(bytes('your string', 'utf-8'))",2372,52,8,0,0
23887881,How to repeat Pandas data frame?,duplicate data in pandas dataframe `x` for 5 times,"pd.concat([x] * 5, ignore_index=True)",2394,52,3,0,0
24242433,"Python - how to convert a ""raw"" string into a normal string",convert a raw string `raw_string` into a normal string,raw_string.decode('string_escape'),2402,52,8,0,0
24242433,"Python - how to convert a ""raw"" string into a normal string",convert a raw string `raw_byte_string` into a normal string,raw_byte_string.decode('unicode_escape'),2403,52,8,0,0
24242433,"Python - how to convert a ""raw"" string into a normal string","decode string ""\\x89\\n"" into a normal string","""""""\\x89\\n"""""".decode('string_escape')",2404,52,8,0,0
25678689,How does python do string magic?,"append array of strings `['x', 'x', 'x']` into one string",""""""""""""".join(['x', 'x', 'x'])",2427,53,8,0,0
25991612,Python / Remove special character from string,Python / Remove special character from string,"re.sub('[^a-zA-Z0-9-_*.]', '', my_string)",2433,53,8,0,0
26155985,Is there a way to refer to the entire matched expression in re.sub without the use of a group?,place '\' infront of each non-letter char in string `line`,"print(re.sub('[_%^$]', '\\\\\\g<0>', line))",2439,53,8,0,0
26541968,Delete every non utf-8 symbols froms string,delete every non `utf-8` characters from a string `line`,"line = line.decode('utf-8', 'ignore').encode('utf-8')",2444,53,8,0,0
27457970,Python regex alternative for join,concatenate '-' in between characters of string `str`,"re.sub('(?<=.)(?=.)', '-', str)",2462,54,8,0,0
27457970,Python regex alternative for join,separate each character in string `s` by '-',"re.sub('(.)(?=.)', '\\1-', s)",2463,54,8,0,0
28134319,Fastest way to remove first and last lines from a Python string,remove first and last lines of string `s`,s[s.find('\n') + 1:s.rfind('\n')],2482,54,8,0,0
28431359,How to decode a 'url-encoded' string in python,"decode a double URL encoded string 
'FireShot3%2B%25282%2529.png' to
'FireShot3+(2).png'",urllib.parse.unquote(urllib.parse.unquote('FireShot3%2B%25282%2529.png')),2489,55,8,0,0
28431359,How to decode a 'url-encoded' string in python,decode url-encoded string `some_string` to its character equivalents,urllib.parse.unquote(urllib.parse.unquote(some_string)),2490,55,8,0,0
28669459,How to print variables without spaces between values,Print a string `value` with string formatting,"print('Value is ""{}""'.format(value))",2496,55,8,0,0
28742436,Combining two numpy arrays to form an array with the largest value from each array,"create array containing the maximum value of respective elements of array `[2, 3, 4]` and array `[1, 5, 2]`","np.maximum([2, 3, 4], [1, 5, 2])",2498,55,6,0,0
29360607,How does this function to remove duplicate characters from a string in python work?,create a set from string `s` to remove duplicate characters,print(' '.join(set(s))),2512,55,8,0,0
29360607,How does this function to remove duplicate characters from a string in python work?,Create new string with unique characters from `s` seperated by ' ',print(' '.join(OrderedDict.fromkeys(s))),2513,55,8,0,0
30385151,Numpy convert scalars to arrays,convert scalar `x` to array,"x = np.asarray(x).reshape(1, -1)[(0), :]",2549,56,6,0,0
30693804,Python: trying to lower a string and remove non-alphanumeric characters aside from space,lower a string `text` and remove non-alphanumeric characters aside from space,"re.sub('[^\\sa-zA-Z0-9]', '', text).lower().strip()",2560,56,8,0,0
30693804,Python: trying to lower a string and remove non-alphanumeric characters aside from space,remove all non-alphanumeric characters except space from a string `text` and lower it,"re.sub('(?!\\s)[\\W_]', '', text).lower().strip()",2561,56,8,0,0
30747705,Parsing string containing Unicode character names,Produce a string that is suitable as Unicode literal from string 'M\\N{AMPERSAND}M\\N{APOSTROPHE}s','M\\N{AMPERSAND}M\\N{APOSTROPHE}s'.encode().decode('unicode-escape'),2563,57,8,0,0
30747705,Parsing string containing Unicode character names,Parse a unicode string `M\\N{AMPERSAND}M\\N{APOSTROPHE}s`,'M\\N{AMPERSAND}M\\N{APOSTROPHE}s'.decode('unicode-escape'),2564,57,8,0,0
30766151,Regular Expression to find brackets in a string,Extract brackets from string `s`,"brackets = re.sub('[^(){}[\\]]', '', s)",2566,57,8,0,0
30945784,How to remove all characters before a specific character in Python?,remove all characters from string `stri` upto character 'I',"re.sub('.*I', 'I', stri)",2569,57,8,0,0
31371879,Split by suffix with Python regular expression,split string `s` by words that ends with 'd',"re.findall('\\b(\\w+)d\\b', s)",2580,57,8,0,0
31522361,Python: Getting rid of \u200b from a string using regular expressions,replacing  '\u200b' with '*' in a string  using regular expressions,"'used\u200b'.replace('\u200b', '*')",2585,57,8,0,0
31771758,"Concatenating Unicode with string: print '£' + '1' works, but print '£' + u'1' throws UnicodeDecodeError",add unicode string '1' to UTF-8 decoded string '\xc2\xa3',print('\xc2\xa3'.decode('utf8') + '1'),2594,57,8,0,0
31818050,round number to nearest integer,round number `value` up to `significantDigit` decimal places,"round(value, significantDigit)",2598,57,5,0,0
31818050,round number to nearest integer,round number 7.005 up to 2 decimal places,"round(7.005, 2)",2603,58,5,0,0
33147992,how to turn a string of letters embedded in squared brackets into embedded lists,convert a string `a` of letters embedded in squared brackets into embedded lists,"[i.split() for i in re.findall('\\[([^\\[\\]]+)\\]', a)]",2644,59,8,0,0
34015615,Python reversing an UTF-8 string,reverse a UTF-8 string 'a',b = a.decode('utf8')[::-1].encode('utf8'),2653,59,8,0,0
34158494,Variants of string concatenation?,"concatenate array of strings `['A', 'B', 'C', 'D']` into a string",""""""""""""".join(['A', 'B', 'C', 'D'])",2658,59,8,0,0
34410358,Splitting a string based on a certain set of words,split string 'happy_hats_for_cats' using string '_for_',"re.split('_for_', 'happy_hats_for_cats')",2663,59,8,0,0
34410358,Splitting a string based on a certain set of words,"Split string 'sad_pandas_and_happy_cats_for_people' based on string 'and', 'or' or 'for'","re.split('_(?:for|or|and)_', 'sad_pandas_and_happy_cats_for_people')",2664,59,8,0,0
35005907,re.split with spaces in python,split string `s` based on white spaces,"re.findall('\\s+|\\S+', s)",2680,60,8,0,0
35044115,Replacing characters in a regex,replace dot characters  '.' associated with ascii letters in list `s` with space ' ',"[re.sub('(?<!\\d)\\.(?!\\d)', ' ', i) for i in s]",2684,60,8,0,0
35118265,Dot notation string manipulation,remove the last dot and all text beyond it in string `s`,"re.sub('\\.[^.]+$', '', s)",2687,60,8,0,0
35269374,get count of values associated with key in dict python,count the number of True values associated with key 'success' in dictionary `d`,sum(1 if d['success'] else 0 for d in s),2690,60,1,0,0
35414625,pandas: how to run a pivot with a multi-index?,"Convert dataframe `df` to a pivot table using column 'year', 'month', and 'item' as indexes","df.set_index(['year', 'month', 'item']).unstack(level=-1)",2692,60,3,0,0
36623789,How to convert unicode text to normal text,convert unicode text from list `elems` with index 0 to normal text 'utf-8',elems[0].getText().encode('utf-8'),2714,60,8,0,0
36957908,Removing white space from txt with python,substitute two or more whitespace characters with character '|' in string `line`,"re.sub('\\s{2,}', '|', line.strip())",2718,60,8,0,0
37584492,Regular expression substitution in Python,remove all instances of parenthesesis containing text beginning with `as ` from string `line`,"line = re.sub('\\(+as .*?\\) ', '', line)",2725,61,8,0,0
38147259,How to work with surrogate pairs in Python?,Print a emoji from a string `\\ud83d\\ude4f` having surrogate pairs,"""""""\\ud83d\\ude4f"""""".encode('utf-16', 'surrogatepass').decode('utf-16')",2732,61,8,0,0
38273353,How to repeat individual characters in strings in Python,repeat every character for 7 times in string 'map',""""""""""""".join(map(lambda x: x * 7, 'map'))",2739,61,8,0,0
38549915,Merging data frame columns of strings into one single column in Pandas,Merge all columns in dataframe `df` into one column,"df.apply(' '.join, axis=0)",2746,61,3,0,0
39532974,Remove final characters from string recursively - What's the best way to do this?,remove letters from string `example_line` if the letter exist in list `bad_chars`,""""""""""""".join(dropwhile(lambda x: x in bad_chars, example_line[::-1]))[::-1]",2764,62,8,0,0
39988589,"How to pass through a list of queries to a pandas dataframe, and output the list of results?","get rows of dataframe `df` where column `Col1` has values `['men', 'rocks', 'mountains']`","df[df.Col1.isin(['men', 'rocks', 'mountains'])]",2779,62,3,0,0
40452956,remove escape character from string,"remove escape character from string ""\\a""","""""""\\a"""""".decode('string_escape')",2801,63,8,0,0
40582103,using regular expression to split string in python,use regex pattern '((.+?)\\2+)' to split string '44442(2)2(2)44',[m[0] for m in re.compile('((.+?)\\2+)').findall('44442(2)2(2)44')],2807,63,8,0,0
41083229,Removing characters from string Python,removing vowel characters 'aeiouAEIOU' from string `text`,""""""""""""".join(c for c in text if c not in 'aeiouAEIOU')",2825,63,8,0,0
41133414,Strip random characters from url,"strip everything up to and including the character `&` from url `url`, strip the character `=` from the remaining string and concatenate `.html` to the end","url.split('&')[-1].replace('=', '') + '.html'",2827,63,8,0,0
41552839,How can I convert literal escape sequences in a string to the corresponding bytes?,"encode string ""\\xc3\\x85あ"" to bytes","""""""\\xc3\\x85あ"""""".encode('utf-8')",2840,64,8,0,0
41552839,How can I convert literal escape sequences in a string to the corresponding bytes?,"convert and escape string ""\\xc3\\x85あ"" to UTF-8 code","""""""\\xc3\\x85あ"""""".encode('utf-8').decode('unicode_escape')",2841,64,8,0,0
42548362,Python. Convert escaped utf string to utf-string,Convert escaped utf string to utf string in `your string`,print('your string'.decode('string_escape')),2875,65,8,0,0
